{
  "slug": "helix",
  "repo": "helix-editor/helix",
  "name": "Helix",
  "tagline": "A post-modern modal text editor.",
  "category": "developer-tools",
  "tags": ["editor", "terminal", "rust"],
  "verified": true,
  "assets": [
    {
      "platform": "linux",
      "arch": "x86_64",
      "kind": "tar.gz",
      "match": "helix-.*-x86_64-linux\\.tar\\.xz$",
      "binary_name": "hx"
    },
    {
      "platform": "macos",
      "arch": "aarch64",
      "kind": "tar.gz",
      "match": "helix-.*-aarch64-macos\\.tar\\.xz$",
      "binary_name": "hx"
    },
    {
      "platform": "windows",
      "arch": "x86_64",
      "kind": "zip",
      "match": "helix-.*-x86_64-windows\\.zip$",
      "binary_name": "hx.exe"
    }
  ]
}
