{
  "slug": "win11debloat",
  "repo": "Raphire/Win11Debloat",
  "name": "Win11Debloat",
  "tagline": "A simple, lightweight PowerShell script that allows you to remove pre-installed apps, disable telemetry, as well as perform various other changes to declutter and customize your Windows experience. Win11Debloat works for both Windows 10 and Windows 11.",
  "category": "developer-tools",
  "tags": [
    "automated",
    "bloatware",
    "bloatware-removal",
    "cleanup",
    "cli",
    "debloat",
    "debloater",
    "interactive"
  ],
  "verified": false,
  "featured": false
}
