{
  "slug": "fd",
  "repo": "sharkdp/fd",
  "name": "fd",
  "tagline": "A simple, fast and user-friendly alternative to find.",
  "category": "developer-tools",
  "tags": ["cli", "rust", "find"],
  "verified": true,
  "assets": [
    {
      "platform": "linux",
      "arch": "x86_64",
      "kind": "tar.gz",
      "match": "fd-.*-x86_64-unknown-linux-gnu\\.tar\\.gz$",
      "binary_name": "fd"
    },
    {
      "platform": "macos",
      "arch": "x86_64",
      "kind": "tar.gz",
      "match": "fd-.*-x86_64-apple-darwin\\.tar\\.gz$",
      "binary_name": "fd"
    },
    {
      "platform": "windows",
      "arch": "x86_64",
      "kind": "zip",
      "match": "fd-.*-x86_64-pc-windows-msvc\\.zip$",
      "binary_name": "fd.exe"
    }
  ]
}
