{
  "slug": "hyperfine",
  "repo": "sharkdp/hyperfine",
  "name": "hyperfine",
  "tagline": "A command-line benchmarking tool with statistical analysis and warmup runs.",
  "category": "developer-tools",
  "tags": ["cli", "rust", "benchmark"],
  "verified": true,
  "featured": false,
  "assets": [
    {
      "platform": "linux",
      "arch": "x86_64",
      "kind": "tar.gz",
      "match": "hyperfine-.*-x86_64-unknown-linux-musl\\.tar\\.gz$",
      "binary_name": "hyperfine"
    },
    {
      "platform": "linux",
      "arch": "aarch64",
      "kind": "tar.gz",
      "match": "hyperfine-.*-aarch64-unknown-linux-gnu\\.tar\\.gz$",
      "binary_name": "hyperfine"
    },
    {
      "platform": "macos",
      "arch": "x86_64",
      "kind": "tar.gz",
      "match": "hyperfine-.*-x86_64-apple-darwin\\.tar\\.gz$",
      "binary_name": "hyperfine"
    },
    {
      "platform": "windows",
      "arch": "x86_64",
      "kind": "zip",
      "match": "hyperfine-.*-x86_64-pc-windows-msvc\\.zip$",
      "binary_name": "hyperfine.exe"
    }
  ]
}
