{
  "slug": "cli",
  "repo": "googleworkspace/cli",
  "name": "cli",
  "tagline": "Google Workspace CLI — one command-line tool for Drive, Gmail, Calendar, Sheets, Docs, Chat, Admin, and more. Dynamically built from Google Discovery Service. Includes AI agent skills.",
  "category": "developer-tools",
  "tags": [
    "agent-skills",
    "ai-agent",
    "automation",
    "cli",
    "discovery-api",
    "gemini-cli-extension",
    "google-admin",
    "google-api"
  ],
  "verified": false,
  "featured": false
}
